{
  "$schema": "https://json-schema.org/draft/2020-12/schema",
  "$id": "file:///Users/yahya/Documents/git/signalJourney/schema/signalJourney.schema.json",
  "title": "Signal Journey",
  "description": "Schema for documenting signal processing pipelines with detailed provenance tracking. Files should follow the naming convention: sub-<participant>_task-<taskname>_signalJourney.json and use UTF-8 encoding. Uses namespaces within the 'extensions' property for domain-specific fields (e.g., 'eeg:', 'nemar:'). Note: Namespaces are reserved; adding new ones requires a formal proposal (see documentation).",
  "type": "object",
  "required": [
    "sj_version",
    "schema_version",
    "description",
    "pipelineInfo",
    "processingSteps"
  ],
  "properties": {
    "sj_version": {
      "type": "string",
      "description": "Version of the signalJourney specification being followed (Semantic Versioning MAJOR.MINOR.PATCH)",
      "pattern": "^[0-9]+\\.[0-9]+\\.[0-9]+$"
    },
    "schema_version": {
      "type": "string",
      "description": "Version of this schema file (Semantic Versioning MAJOR.MINOR.PATCH)",
      "pattern": "^0\\.2\\.0$",
      "const": "0.2.0"
    },
    "description": {
      "type": "string",
      "description": "A brief human-readable description of the processing pipeline documented in this file."
    },
    "versionHistory": {
      "type": "array",
      "description": "Tracks changes made to this specific signalJourney file over time.",
      "items": {
        "$ref": "file:///Users/yahya/Documents/git/signalJourney/schema/definitions/versionHistoryEntry.schema.json"
      },
      "default": [
        {
          "version": "0.2.0",
          "date": "2024-05-06",
          "changes": "Refactored InputSource/OutputTarget into separate definitions. Added 'inlineData' targetType."
        },
        {
          "version": "0.1.0",
          "date": "2024-05-03",
          "changes": "Initial schema structure definition."
        }
      ]
    },
    "pipelineInfo": {
      "$ref": "file:///Users/yahya/Documents/git/signalJourney/schema/definitions/pipelineInfo.schema.json"
    },
    "processingSteps": {
      "type": "array",
      "description": "An ordered list of processing steps applied.",
      "items": {
        "$ref": "file:///Users/yahya/Documents/git/signalJourney/schema/definitions/processingStep.schema.json"
      },
      "minItems": 1
    },
    "summaryMetrics": {
      "$ref": "file:///Users/yahya/Documents/git/signalJourney/schema/definitions/qualityMetricsObject.schema.json"
    },
    "extensions": {
      "$ref": "file:///Users/yahya/Documents/git/signalJourney/schema/extensions/extensionsContainer.schema.json"
    }
  }
} 