{
  "sj_version": "0.1.0",
  "schema_version": "0.2.0",
  "description": "Minimal valid Signal Journey file (schema v0.2.0)",
  "pipelineInfo": {
    "name": "ExampleMinimalPipeline",
    "description": "A minimal example pipeline for testing.",
    "version": "1.0.0"
  },
  "processingSteps": [
    {
      "stepId": "preproc-01",
      "name": "High-pass Filter",
      "description": "Apply a high-pass filter",
      "software": {
        "name": "MATLAB",
        "version": "R2023b"
      },
      "parameters": {
        "cutoff_hz": 1.0,
        "filter_type": "butterworth"
      },
      "inputSources": [
        {
          "sourceType": "file",
          "location": "raw_data.set",
          "format": "SET"
        }
      ],
      "outputTargets": [
        {
          "targetType": "file",
          "description": "Filtered EEG data",
          "location": "derivatives/filtered_data.set",
          "format": "SET"
        }
      ]
    }
  ]
} 